{
  "$schema": "./docs/template-manifest.schema.json",
  "id": "creator-launch-os",
  "name": "Creator Launch OS",
  "version": "1.1.0",
  "license": "MIT",
  "maturity": "remixable",
  "audiences": [
    "digital-product creators",
    "authors",
    "educators",
    "independent studios",
    "community builders"
  ],
  "jobToBeDone": "Publish, explain, sell, and operate a small catalog of digital products from one owned website.",
  "stack": {
    "framework": "Next.js 16 App Router",
    "language": "TypeScript strict",
    "styling": "Tailwind CSS 4",
    "motion": "GSAP 3 with @gsap/react",
    "deployment": "Vercel"
  },
  "routes": [
    "/",
    "/products",
    "/products/[slug]",
    "/checkout/[slug]",
    "/studio",
    "/api/health",
    "/start",
    "/studio/templates",
    "/studio/templates/[templateId]",
    "/studio/templates/[templateId]/edit"
  ],
  "requiredEnvironmentVariables": [],
  "optionalEnvironmentVariables": [
    "NEXT_PUBLIC_SITE_URL",
    "NEXT_PUBLIC_CONTACT_EMAIL",
    "NEXT_PUBLIC_CHECKOUT_GUIDE_URL",
    "NEXT_PUBLIC_CHECKOUT_CONSOLE_URL",
    "NEXT_PUBLIC_CHECKOUT_AUDIO_URL"
  ],
  "sourceRepository": "https://github.com/frankxai/creator-launch-os",
  "deployUrl": "https://vercel.com/new/clone?repository-url=https%3A%2F%2Fgithub.com%2Ffrankxai%2Fcreator-launch-os&project-name=creator-launch-os&repository-name=creator-launch-os",
  "verification": {
    "typeCheck": "Candidate verification is recorded in docs/RELEASE-INTEGRATION-20261021.md; prior declarations are preserved in docs/HISTORICAL-VERIFICATION-20261021.md.",
    "lint": "Candidate verification is recorded in docs/RELEASE-INTEGRATION-20261021.md; prior declarations are preserved in docs/HISTORICAL-VERIFICATION-20261021.md.",
    "contractTests": "Candidate verification is recorded in docs/RELEASE-INTEGRATION-20261021.md; prior declarations are preserved in docs/HISTORICAL-VERIFICATION-20261021.md.",
    "productionBuild": "Candidate verification is recorded in docs/RELEASE-INTEGRATION-20261021.md; prior declarations are preserved in docs/HISTORICAL-VERIFICATION-20261021.md.",
    "cleanAccountDeploy": "NOT_RUN: an owner-account deployment or HTTP 200 does not prove a fresh-customer account clone and deploy.",
    "browserDesktop": "Candidate verification is recorded in docs/RELEASE-INTEGRATION-20261021.md; prior declarations are preserved in docs/HISTORICAL-VERIFICATION-20261021.md.",
    "browserMobile": "Candidate verification is recorded in docs/RELEASE-INTEGRATION-20261021.md; prior declarations are preserved in docs/HISTORICAL-VERIFICATION-20261021.md."
  }
}
